ID,label,review
3260,Negative,Low quality thay kaafi Matlab itnay paison mein meine yehi cheez expect kari thi Wese comfortable hai raat mein aapko konn dekhta hai islie mein yeh mangwaye us hisaab se sai thay ye kaam chalau
3261,Positive,Fan e adakari ke shobe mein Abid Ali ko aik legend ki hesiyat hasil hai
3262,Positive,MashaAllah
3263,Negative,aur ab km taleem ya adhori taleem ki wjha sy koi dhang ki job nahi karskti
3264,Negative,Utility stores par chini ki qemat asal qemat se derah guna ziyadah thi is baat ko hukumat danista nazar andaz karti rahi
3265,Negative,cmnt delete kr raami
3266,Negative,koihall ni pakistani awam k b
3267,Positive,Ye kurti bari achi hai iska print mujhay acha laga aur pehnney mein bhi comfortable hai Aaj kal kay mausam kay hisab sey color aur kapra dono suitable hai
3268,Positive,Hr ik parcham sa uoncha parcham e Islam ho jaya
3269,Positive,Hahaaa good one
3270,Negative,Lanat ho in pr
3271,Negative,Kal k baad koi kuta he hoga jo jaega
3272,Positive,To Umrain Beet Jaen Gi Kaha Na Achay LaGty Ho To Bus Lagtay Ho
3273,Negative,aunty nay pora hath hi daal dia bhai
3274,Negative,Mushkil hei lg raha
3275,Positive,Ahahaha han bhai hogye tasalli
3276,Positive,Wah yr bht zabardast
3277,Positive,Nzar na lge aap ki khushyo kp
3278,Positive,She played a fantastic role in the drama serial Aangan Terha with Shakeel Siddiqui and Saleem Nasir Late
3279,Negative,kuch khas nhi hai
3280,Negative,Jahil awam ko jahil leader ki hi zroorat hai yeh Aunty bachon ko parhney k liye school nh pyari pyari sarkoon pr bhejey gi D Nawaz sharif to 3 3 mahiney london rehta hai sarkein kya khaak banaye ga
3281,Positive,Acha pad h quality achi h aur stiching bhi achi h Thanks
3282,Positive,Good msg keep it up
3283,Positive,Meray Bandon Ko Bata Do K Main Bakhashnay Wala Aur Meharban Hun
3284,Negative,rangbazi jo baki halfo may merit compromise kia wo
3285,Negative,Ye 1st Ramadan se Kinza Shaitan geri kar rahi hai jab se Drama Start huwa hai aur 1st Ramadan se Shaitan band hai aur sach pochiye toh ye Kinza Shaitan ki kami mehsoos hone nhii derahi
3286,Negative,Asay police walo ki waja se pura pakistan badnam hota hay Plz I G police thake action against this poileman kindly we all of looking just your side Plz
3287,Positive,DJ Imran ali Mani ap muje Sub k samne I love you kiun ni keh dete
3288,Negative,Bas yaar tum dono k saath reh k mein bhi aisi hogae hu
3289,Positive,Is hawale se in ka kehna tha ke in ke nazdeek sab se barha aezaaz koi award nahi bal ke maddahon ki taraf se milne wali pazeerai hai
3290,Positive,Bazmi sahib phir bhi mutmain na howae lekin jab ye gana super hit howa tab un ka mode durust howa
3291,Negative,Ashfaq Ahmed ne apne kaam ke hawale se jahan dunya bhar se daad sameti wahe ek makhsoos halqe ki taraf se in par khasi tanqeed bhi hui
3292,Negative,Uske Dil Me Dukh Zaror Rehta Hy
3293,Positive,Right mara jasa masom log
3294,Negative,Ye kafar he polis waly
3295,Negative,Karobari raqebon ne Waheed Parvaiz Sohail aur Masroor Ki Company ka nam chandal choukri rakh deya tha aur unki her nae film ka ilan dushmanon ki safon mein khalbali macha deta tha
3296,Positive,Daikha Ho Tou Aa Mere Ujrey Howay Bikhrey
3297,Negative,Oo bhae mene pehlay earphones hi nae utarnay tay us narial ki baat sun nay kay liyay
3298,Positive,Sap ko bhi eidmubarak
3299,Positive,Q k Nawaz ko pta he k men senate men bari jamat hony k bawujud hara hova hun Nawaz ne sirf Raza Rabbani ki hamayt ka kaha lekn zardari ye ni chata k kal ko nawaz ye na kahy k PMLN ki hamayat the tb Senate Chairman bna ppp ka
3300,Positive,Hahahahah sunbal toh unki jaan hai naa
3301,Positive,In dono ne aehad kiya ke wo aala taleem hasil karenge aur angrez ki mulazmat ke bajae us ke khilaf jahad karenge
3302,Negative,ALLAH ne qyamt tk apny gar ke hifazt krni h us ka wada h or is ko ibraat nak saxa milni chahy dunia Mai b
3303,Positive,Mulk mein ayenda jamhuriyat ko farog daynay kay leye unhon nay apas mein mulaqaton ka aik silsila shuru keya jo ARD kay qayam par muntahij huwa
3304,Negative,Han tmharai tarha ham bhi gadhay ka gosht khaty To shayad ye kachra nahi hota bcOz tm to gadhay ka gosht khalaety ho kachra Kia chezz hai
3305,Positive,Bilkul sahi
3306,Positive,Brian Lara ne 131 test matches mein 11953 runs score kiye wo test matches mein sab se ziyada runs banane ke aitebar se duniya mein 4th number par hain
3307,Negative,Sirf punjab ne kaam karana unki pmln ki zimedaari nahe thi Aur abhi jo lahore mei haal hai yeh karwayaa nawaz sharif ne
3308,Positive,Allah salamat rakhe
3309,Positive,Woww nice sada salamt raho
3310,Negative,40 Saal kaay honay par bhi agar insaan bad amal hi karta rahay tou phir shaitaan uss insaan ko bossa daita hai dosary lafzoon main akhrat main yeh insaan juhnum main janay saay naheen bachay gaa Aur shaitaan ki iss main kamyabi hai
3311,Negative,to tera maqsad bhi to PM banna hi hoa na bhai
3312,Negative,Mny mis KR di aj ki episode
3313,Negative,Liaquatabad Me Firing 1 Shaks Zakhmi
3314,Positive,KPK Hakumat Ka Suba Me Roz Gaar Ki Farahmi K Lye Billa Sood Qarzey Faraham Krne Ki Scheme Shuru Krne Ka Faisla
3315,Positive,Bangal Se Aanay Wala Barish Ka System Kal Sunday Pakistan Me Dakhil Hoga Karachi Me 120mm Barish Ka Imkan
3316,Positive,Itni piyari sharkaaainn
3317,Negative,Is soorat e haal mein khas taur par Wasim Akram ko shaded mushkilaat ka saamna karna parha
3318,Positive,Aap Maulana Mohammed Ali Jauhar ke news paper Comrade ke aezazi mudeer bhi the
3319,Positive,Yehi wajah hai ke in ka intekhab is qadar jama hota hai ke shaiyqeen ussh ussh kar uthte hain
3320,Negative,Hahahaha meri adaten khrab kren aap
3321,Positive,Daraz pk ne tou dil hi khush kardiya itni zabardast slippers hain yeh pehnne mein toh achi lagti hi hain quality wise bhi achi hai toh mein tou bilkul mutmaeen hun kyunke market jesi price mein agar ek cheez apke ghar deliver kardiya jaye toh kia masla hai
3322,Negative,Ya hum pas thy us k woh zindagi k kuch din Yaa zindagi thi kuch din
3323,Negative,Intekhabat mein chalaie janay wali mohim kay dauran 27 December 2007 ko Benazir Bhutto Liaqat bagh Rawalpindi say aik jalsay amm say khitab kar kay bahar nikal rahi thein kay unki gari par fairing huie aur uskay sath hi aik falak sagaf dhamaka hua
3324,Negative,Murs 03004328290 p bta kl lga lena
3325,Positive,Wah
3326,Positive,Wah wah yeh toh hy
3327,Negative,Billo aunty or DJ kholein gy nawa katta
3328,Negative,Humare masher ki khawateen wani Quran se shadi zabardasti shadi gherat ke naam par qatal teen bayak waqat talakon aur wirasat se mehromi jese ghambeer masail ka shikar hai
3329,Positive,mil jae ga dnt worry
3330,Positive,Musalmano ne geographic ko jo taraqqi di hai
3331,Positive,Allah pak salamat rakhy
3332,Negative,Zehreely ap hen xochna apko hai ap nikammy hen ik pr ye chota xa kam xochny ka to ap kr hi xkty hen apny guthno pe zor de k
3333,Positive,mashallah Allah salamat rakhy
3334,Negative,jisko jitna chaho ge use utna hi d0or pao ge
3335,Positive,Waqas or maqbool ka accama ban jay dua kty
3336,Negative,Yon university campus mein aaye roz tashaddud ka silsilah shuro hogaya
3337,Positive,very good
3338,Negative,Ya Rabbe kaynaat Musharraf KO tabah o barbad karde
3339,Negative,ak pata nahi halay ga
3340,Negative,Molvi Abdul Haq jama e Urdu ke qayam ke khuwahishmand the taham un ki rehrat se ye masoba adhora reh gaya
3341,Positive,ya ya they have all rights to do that with out any regret
3342,Positive,Baz fankar maqboliyat aam hasil na kar sake lekin alla elmi o adbi satah rakhne walon mein maqbol howe
3343,Negative,Waqai mai yr yeh pura hum pr bana hai aisa hi huwa tha kahi bhi nazer hi nh aya
3344,Positive,Wah he was the person behind the camera
3345,Positive,Iss yadgar tareekhi chahke ki badolat na sirf Javed Miandad ne Pakistan ka riwayati hareef se mini world cup ki shikast ka badla liya bal ka Bharat ko nafsiyati tour per aisa majroh kiya ka iss ke bad Bharat ki team kabhi Pakistan ki ankh mein ankhein dal kar na dekh saki aur bain ul aqwami muqabalo International Cricket mein Pakistan ka palra Bharat ka moqable mein hamesha bhari raha
3346,Positive,Agr sath mai danis b aa jayeee tou mazaa aa jye
3347,Positive,Ubqari buhat acha name hy ap ko koi problem hy
3348,Negative,Bjp Modi gaya tha vidio banane aur nawaz shareef ko biryani khilane
3349,Positive,Manasik e Hajj Ka Aghaz Lakhon Farzandan e Tohid Mina Puhonch Gaye Khaimon Ka Bara Sheher Bas Gaya Kal Arafat Rawana Honge
3350,Negative,16 MPO K Tehayt Nazer Band Kal Adam Lashker e Jhangvi K Serbarha Malik Ishaq Or In K 2 Bayton Samet 4 Afrad Ku Ne Griftar Kr Lia
3351,Positive,Allah raham farma Ameen
3352,Negative,aunty kitna bara haath hai lol
3353,Positive,Supreme Court mein bhi aik nayi tawanai peda ho gai aur janab Justice Iftikhar Muhammad Chaudhry ko un ke mansab se hatane ki koshishs un ke sathi Judges ne hi nakaam bana di
3354,Positive,Us waqt Islamabad ke bad Kangri House Karachi mulki siyasat ka dosra barha markaz tha
3355,Positive,Jis shobey mein bhi inho ne qadam rakha aur khud ko aehal aur ba kamaal sabit kiya
3356,Positive,Farishto ka Nuzool Aakhir Surto n ki tafseer
3357,Positive,Jis shakhs ne sari zindagi nazreen aur tamashaiyon ke saamne apne funn ka muzahira karne mein guzari ho wo bhala sharmeela kis tarah ho sakta hai lekin haqiqat yeh hai ke Zia Mohyeddin sharmeele hain aur is silsile mein main apni taraf se kuch kehne ke bajae khud un ke alfaaz dohrana chahonga
3358,Negative,Mujay anti Imran Khan videos mat dikhao
3359,Positive,jee ye to he
3360,Negative,Astaghfirullah Allah reham kare
3361,Positive,Tujhe pata ha me q Hans Raha ho ye jis k bat Kar Raha ha vo 2 sal porani bat ha aur ye abi qundooz k accident k sath ye munsalik Raha ha
3362,Negative,Aankhon mein Na hai koi khwab Bs ik La MahdooD Udaasi hai Be intaha Chahat k Sath
3363,Negative,tu kiya puja karay in kameeno ke
3364,Positive,Hazrat Sahib se mulaqat ke liye Surah Quraish 40 times shuru akhir 3 time Darood perha krein din mein aik mrtba ya jitna ho saky InShaa Allah mulaqat ke asbab bn jai gee 40
3365,Negative,tumy bhot bhar gie h
3366,Negative,Allah in zalemu ko saza dy
3367,Negative,Amaaa Teri Aqal ko salam
3368,Positive,Good 1
3369,Negative,Han lkn lame e lgrh ha
3370,Negative,Gan phatii k bhahrway bharway
3371,Positive,Ellah muslem ko mujahid isllam ko kamyab banalo
3372,Positive,Zabrdast cheez ha km amount main
3373,Negative,Munasib Security Ki Adam Farahmi K Bais Karachi Me Insidad e Polio Muhim Ko Rok Dia Gaya
3374,Positive,Ye tarbiyati course aik saal mein mokammal kar laynay kay baad app nay Intermediate ki sanad li
3375,Positive,Unhon ne nasar nigari mein sir Syed aur Hali donon ke asrat shamil keye aur un jesa hi aslob ikhteyar kiya wo Sir Syed ki tehriron se ziyadah mutasir howe is leye unhon ne sadgi aur salasat ke bawajud Sir Syed ki tehrir ki shagutagi ko pesh e nazar rakha aur Hali jesi rokhi pheki tehrir lekhne se gurez kiya albata un ki nasar mein kush tabi aur sanjidgi ka aik haseen tawazun paya jata hai
3376,Negative,Sasti hoo es lye hastiii ho
3377,Negative,Fazool shirt fazool print kabhi na kharidna
3378,Positive,Aj ap ny dil he jeet lia jo kuch howa aj election commission ky offc may fee submitte karwaty howy
3379,Negative,Party Rehnuma Chahtay Thay Main Ghar Me Chapatian Banati Rahun Shadi Ki Angothi Tak Nahi Mili Ghar Me Taweez Bhi Milay Reham Khan
3380,Positive,thankew sooo mch anty
3381,Positive,Tehrik e Insaf K Memberaan Apni Tankhuwaen Flood Relief Fund Me Dain Gey
3382,Positive,Wo bacha bach nahi saka magar mehaz Lady Diana ki mohabat o shafqat ke ehsas ne us ki aziyat kam kar di
3383,Positive,Bari dair kardi meharban aate aate
3384,Negative,Aunty ji tumari tarhan unparh hain bichari
3385,Negative,Market se yehi pack 50 to 60 R s main mill jata hai
3386,Negative,Aik gallon ice cream ki kami thee bus aaj
3387,Positive,University ki mulazmat ke bad Pakistan National Centre Peshawar ke director muqarrar hue
3388,Positive,Mari bati ur un ky ghar walon kyliay dua ki darkhwast ha
3389,Positive,Politician ko adab aur adeeb ko siyasat ke asbaaq azbar hote the
3390,Positive,mjhe tw yeh bohat hi ziada acha hai price iski bohat kam hai lekin is mein koi kharabi nahi hai led bright hai aur time b sahi ata hai is mein doosri bat yeh hai k yeh pehenne mein comfortable hai iska rubber bohat soft hai kafi stylish lagta hai mjhe tw khush hoon main is se
3391,Negative,Aye haye haye niklo
3392,Negative,Kise malom tha ke ye bandhan aik ese almiye par anjam pazir ho ga jo logon ko aindah na jane kitne barson tak afsurdah karta rahe ga
3393,Negative,Ye so called human n womem rights activists kahan hyn
3394,Negative,Pazeerai to khoob mili lekin ghar walon ka rawaiyya na badla
3395,Negative,Mai ne medium size order ki thi sari ki sari large aai hn
3396,Negative,Airport Ka Nizam Darhm Barhm
3397,Negative,Mushtaq Muhammad ke sath bhi un ki banti nah thi aur jab wo catptain banne to Intikhab Alam ki team mein shamoliyat par kisi tor par razi nahi the aur is mamle par un ka board se jhagra bhi ho gaya
3398,Positive,20th senchery mainQadam qalam our quloob per Alam Geer mehnat ager Kisi ne Ki he to Wo Ap hain
3399,Negative,Khuda kaley aik fool topic py mat larain
3400,Positive,Wo aaj bhi kisi drame ke set par hon to nihayat inkasari aur piyar ke sath apne juniors ko apna fan aik ustad ki tarha muntaqil kar rahe hote hain
3401,Negative,Min haisul qoam ham sab hejray hein
3402,Negative,Asliat kuch mukhtalif thi
3403,Positive,Lekin jab Sir Hashim ne kuch official baat karna shuru ki to andaza huwa k koi khatra nahi tha
3404,Positive,Hindustani art cinemas ke qad aawar artists ki top of the list murattab ki jae to Farooq Sheikh ka naam yaqeeni taur par is mien shamil ho ga
3405,Negative,bhai nhi baji kaho D D
3406,Positive,Masha Allah cute nice Both Mola Salamt or Khosh o Aabad Rakhy
3407,Positive,Hazrat jee mera bhi salam qabool karen
3408,Negative,Chooorrr dakoooo lutaryyyy sharifa family
3409,Positive,Awla kaam kerdia hai agar bach gae hongy to khudi baaz ajain gaye r yaad rakhy gae k last time bund pay fire wajy thy ab nahe kerna
3410,Negative,behnaa ni shareef hoskti
3411,Negative,Bajawar lal musjid hafia sedeqi imal kasi abdul sallam zaif 4000 pakhtoon gar masmar karna taliban bichna musharaf farviz musharaf he
3412,Negative,yeh bacha nihqyat batmeez or dramay baaz ha i hate this kid isy pehly b kch shows ma dekh chuka hun
3413,Negative,Kuch bhi nahi pata bus uski personality pasand hai tumhay jiski waja sey itni mari ja rahi ho
3414,Positive,Is se Bhar kar or kia chahye k Allah Taala Apna dedar atta kary
3415,Negative,Beshumar lanat is kafir pe latka do isko
3416,Positive,Apki soch ko 21 topo ki salami
3417,Negative,UNHY jinsi toor br harasa krny ki kosis nhi blky aye roz unhy harasa kea jata hy
3418,Negative,tharky baba ki bat sach hony wali h
3419,Positive,Raja gidh novel ki khaliq Bano Qudsiya Urdu ki maroof adeeba hai
3420,Negative,Hahahaha ach paanje grp me chugli kroon thaa
3421,Positive,Wow great talent Masha Allah
3422,Positive,Wo munfarid aur barhe records ke maalik hain
3423,Positive,Ap bht Khbsoorat lg rhe ho
3424,Positive,Murshid aik tawajjah ki nazar mujh par bhe
3425,Negative,wukla tehreek kay daouran mazole Chief justice Iftekhar Muhammad Chaudhry ki bahali kay leye Nawaz Sharif nay bhar pur balkay kalidi kirdar ada keya iss kay alawa NRO jaisay badnam zamana qanun ko parliament say manzoor nahi karwanay kay silsilay mein bhi Mian Sahab ka kirdar sab say zayadah ahmeyat kay hamil raha
3426,Positive,Agar nai kar sakty tu un mein jo thora behtar lagta ha us Ko vote daina pary ga
3427,Negative,bilkul hee kachra kisam ka necklace tha yay halka sa paseena anay k baad is ka color hee ur gya pura biklul hee na kabil ay istamaal ban gya yay isay utha k kachray may paink dia mainay to bilkul hee baykaar tareen cheez hai yay
3428,Negative,Roooo swar k roo
3429,Negative,Ahle Khana Ne PS Shara e Faisal Me Report Jama Kara Di
3430,Negative,or mara tujha marna ko karta ha
3431,Positive,Apni bhar pur awaz mardana wajahat aur purtasur chehre ke bais wo pheli hi nazar mein nazreen ko bha gaye
3432,Negative,G nh kmeeniyo m shreef dekhti nh hu b
3433,Positive,Javed Miandad ne kahi munfarid records apne naam kiye woh musalsal 6 world cup mein hissa lene wale wahid khilari hain aur in mudad chand khilariuon mein se kia jin ki test matches mein euns banane ki average kabhi 50 se niche nahi ai 2009 mein Imran khan aur Hanif Mohammad ka sath inhein 1CC ka Hall of Fame mein shamil kiya gaya
3434,Negative,pse to mai kabi na bolon tumhe
3435,Positive,Is azeem kaam mein unhen jo kamyabi nasib hoi wo yaqenan heratnak hai
3436,Positive,Allah pak Aap ka Saya tadyr tamam mkhloqat pr qaim rky Ameen
3437,Positive,salam dear bht he acha phon hy muje kal he rcvd hua hy thenk u daraz
3438,Positive,Iss tara Ansar Burney ko kai baras tek jailon ki surat hal aur qaidyon ki halat zar ka chasm deed moshaheda ker ney ka moqa mil gea unhon ney qaid khaney hi mein yeh faisla ker lea kay jab bhi rahai mili bea gunah aur mazloom quidyon ki najat key leyeh koi adara quaim kerein gein
3439,Negative,Iss sey pehlay kay Karachi waalay apni bkwaas ShuRu karr dyn Mai unhay yehi kahoon ga kay Unn ki apni Mandiyoo mai Kuttay bik rhay hyn uss ka Kiyya
3440,Positive,Rana Fawad sb great personALLAH PAK UNHY KHUSH RAKHYAMEEN
3441,Negative,aa keery nikalty hain logon mai happened oftn in gym
3442,Positive,Km se km 2017 me to nahi dekh sakty ager dunia baki rahi to 2100 me shyed sudhar jayn
3443,Positive,Jis ka aiteraf yeh khud bhi karte the
3444,Positive,Ashfaq Ahmed apne dramon mein plot se ziyada mukalmey par zoor dete the aur un ke kiradar taweel guftugo karte the
3445,Positive,Tawaf e Kaba Ko Ay Insan Tere Kamon ki Kia Auqaat Hy Jis K Liye Tu Namaz Ko Chor Deta Hy
3446,Positive,Barthday Mubarak ho sr
3447,Positive,anum tum kini pyari ho
3448,Negative,Mukhtalif Hadsat Main 2 Afrad Janbahaq 9 Zakhmi
3449,Negative,Crane Hadsay K Baad Bin Laden Company Ku Mazeed Kaam Na Milnay Ka Imkan Sath Uhdaydaron K Mulk Chornay Pr Pabandi Aiad
3450,Negative,Nasir Iqbal Aaj ke dor mein khilari beron e mulk ja kar nahi kheel sakte yahan agar kheelna chahein to yahan international tournaments nahi ho rahe zahir hai ke jab ranking behtar hone ke mawaqe mehdod hon ge to aap acha kheel kheel
3451,Negative,Main ne toh tjhe kaha hi nhi Tou khudi dil pe le gya
3452,Positive,Khud shahrukh khan ka is silsile mein yeh kehna hai ke Major General Shahnawaz in ke walid ke azeez the
3453,Positive,Inka har andaaz munfarid aur har roop judagana hai
3454,Negative,Lanat hai kanjron pe
3455,Positive,Means ap k rozay buht acahy guzar rahy ha
3456,Positive,Subhan Allah beshak
3457,Negative,1944 mein Hindustan chor do ki tahreek mein lathi charj ka shikar hoker app ki do paslian toot gayein
3458,Negative,ALLIED SCHOOL PH 1 WALE KEHTE HAN K COURT K ORDER SE HMARA KOI TAALUQ NHI H
3459,Negative,Bhatak rahay hain
3460,Negative,MQM Dehshatgard Hy
3461,Negative,Hahahaha Punjab ban gya Baki Karachi ki kisi ko nhe fikar sai ja rhe hai gadhe khane walle
3462,Negative,abyy bhai rhny du tum ab Qoum 3 basic need sy banti hai Health Education FoodYe roads wghera baad ki batein hai shaoor ki bt hai bss ur kch nhiEk kilo ata deny wala vote le jata hai lkn ye nhi sochty k humen ye ataa khud kamana kon sikhaega
3463,Negative,Giriftar Mulzim Police Ahilkar Nikla Kamran Jail Ki Security Me Tynat Hai Mazamat Pr Bachi Zakhmi Hoyi
3464,Negative,1984 mein jaali refrendam ke dauran aik baar phir giraftar hue aur April 1985 tak jail mein rahe
3465,Positive,Anna Molka Ahmed ke baad ane wale fankaron ne in shah paron se behad istefadah kiya aur art ki taraqi ka bais banne
3466,Negative,Ao logon ko stalk kartay hein
3467,Negative,Nazimabad Me Firing Se 1 Shakhs Janbhaq 2 Zakhmi
3468,Positive,fiqr na faqaa aish kr kaka
3469,Positive,Benazir Bhutto nay doraan e taleem Oxford Union kay intakhabaat mein hissa liya aur union ki president muntakhab hoyein
3470,Negative,Aao gheebat gheebat khelain
3471,Negative,latoo zarf kha se agya
3472,Negative,Jo jo b shamil on sb py lannnnatttt beshumar
3473,Positive,Medical College Jali Degree amp PMDC K Ghaplon Me Dr Asim Ka Hath Ta Teqiqati Idaron K Sath Tawun Karenge
3474,Negative,Tahum hairat angez taur par yeh show nazreen mein wo pazeerai hasil na kar saka
3475,Negative,Qayam e Pakistan ke bad Hashim Khan ne royal air force club mein bahasiat Squash coach molazmet ikhtiyar ki aur khud ko suba sarhad mein hi mahdood kar leya aisa lagta tha ke woh Pakistan ki had tak hi mahsoor hoker rah jaein gey
3476,Positive,jiya ko realize h gaya k sherry us ko support kr skta h mgr hifazat nh
3477,Negative,Kia kahon yar bs
3478,Positive,Ya Allah tauba ke baghair maut na dena ya Allah jab tu hum sy razi hojaye tab bulana Ameen
3479,Positive,1965 ke intekhabat mein Allama Raghib Ahsan ne Madr e Millat Mohtarma Fatima Jinnah ke haq mein aur president Ayub Khan ke khilaf mashraqi Pakistan mein be had kaam kiya
3480,Positive,MashAllah bht cute hain dono
3481,Positive,Q K Mafi Mangne K Bad B
3482,Positive,Imran khan pooray pakistan ke liye soch rahaa hai
3483,Positive,Ya hum sub ka khatma bil khair frmana
3484,Negative,Fazool
3485,Positive,Bht Acha Soap hai n Quick delivered
3486,Positive,Edhi mustaqbil ki taraf dekhte huwe kahte hain woh Pakistan kay har alaqay mein per hospital tameer karna chahte hain
3487,Negative,Tahum is sone ko kundan banana ka sehra Baba e radio Syed Zulfiqar Ali Bukhari ke sir hai jinho ne Mohammed Ali ko apne saya e atifat mein le kar awaaz ki aesi tarash kharash ki ke mulk bhar mein koi bhi sadakar Mohammed Ali ka muqabla na kar sakta tha
3488,Positive,In ka muntakhib karda kalaam samaton ke zariye audience ke adraak o shaoor ki gehraiyon mein apni tamam tar maeyne aafrini ke sath utarta chala jata hai
3489,Positive,Allah hazrat g ko slamat rakhay
3490,Negative,Yar dunia chand py punch gae or hum log abhi yeh sub karny main hi lagy hai kabhi media dikhata hai k yeh larka apni aankhen bht bahir tak nikal sakta hai to kabhi yeh
3491,Negative,in logon ka koi deen iman nahi
3492,Negative,ALLAH walo dars par dehan dain bataon main na lagay
3493,Positive,HahahahahahahahahahahaAy taa teda azlan da sapna ayyy
3494,Negative,Farooq Basketball chor football khela kar P
3495,Positive,Jaya ko bohat se aise kirdar mile jin mein inhe acting ke johar dikhane ka mauqa mila
3496,Positive,Hum dekhenge lazim hai ke hum bhi dekhenge Jab takht giraae jaenge Jab taaj uchale jaenge In nazmon ko apni khobsurat aur munfarid awaaz mein gaa kar Iqbal Bano ne Amar kar diya aur khud bhi Amar ho gai
3497,Positive,Mashallah bhot khoob sir
3498,Positive,Eid Mubarak aapko bhi
3499,Positive,Agar use kisi third person se koi baat maloom hui to use is liye aehmiyat nahi degi kyun ke wo pehle se is ke barey mein janti hai
3500,Negative,Hana yr wo to ata he nhi ha paper me
3501,Negative,Haha ap plz mat pagal bano careem walo ki bato se ye just awam ko bewKof banana janty hain
3502,Positive,Allah madad kare
3503,Positive,Anna Molka Ahmed ki koshishon se Punjab University fine art department jald hi mustehkam ho gaya aur talba ko fine art se khusosi lagao paida ho gaya
3504,Negative,Shora
3505,Positive,Yahan tak ke in ki shohrat ghar ghar pohanch gai bilkhusoos in ka yeh jumla zabaan zadd khaas o aam ho gaya
3506,Negative,16 August 1946 ko jab Muslim League ne Yom e rast iqdaam manaya to hindoun ne Calcutta mein musalmano ke khoon se holi kheli is mauqey par bahesiyat wazeer e aala apne tadbeer se fasadaat ki aag ko ziyada bharakne nahi diya
3507,Negative,Poura ilaaqa jaahil ka jaahil reh gya
3508,Negative,Emma Watson 5 baras ki umer tak apne waldain ke darmiyan alehdgi tak Paris he mein rahi
3509,Negative,Saeed Khan apni bkwas apny pas rakho
3510,Negative,hahaha mera baag bhi jata sth r koi janny wala b nhi tha us din route mn
3511,Negative,Par 6 9 Shiddat Ka Zalzala
3512,Negative,Oh yes Jis ne face pe aata mala hoa hota hai Haina
3513,Positive,jab wo bhi ban gaya to socha k circuit bana hi lo
3514,Negative,Seth chotani ko angrezon ne apni resha dawaniyon aur sarkari aehkamat ke zariye dewaliya kar diya aur wo is sadmey se is daarfani se kooch kar gaey
3515,Positive,hmri jugjmnt kaml ki ha nw
3516,Negative,Banday da puter ban te aqal nu hath paaRamzan hai mere kolo kuj sun na lawi
3517,Negative,Bakwas tareen They don t send actually what you order u guys should stop making fool peoples ghatya colours lowest cloth quality
3518,Positive,Mery ma bap k liye dua karin
3519,Negative,khuda garat karey in logon ko astagfirullha
3520,Positive,Pakistan Me RAW Ki Sargarmiyo Ka Mamla Aqwam e Mutahida Me Uthane Per Ghor
3521,Negative,Lanat Teri zaat par Kutty
3522,Negative,Nae tu b puri jahil meri trha p
3523,Positive,Is tarah Helen Keller ki zindagi mein taleem ka aghaz howa aur baad mein wo mukhtalif marahil te kar ke aik shandar musanifa bani
3524,Positive,1992 hi mein Sadarti Award barae Husan e Karradagi se nawaza gaya
3525,Negative,ye youth k laptop ki screen darmiyaan se hi kion kharab hoti hye
3526,Negative,waja behn Bs jo keh dia wohi hna chahye
3527,Negative,Rajiv Gandhi bomb blast ke natije mein chal base
3528,Positive,Razia Sheer Khan Abhi to mereghar walon ne mujhe har tarh ka support kiya hai
3529,Positive,In ka show Jeena Isi Ka Naam hai dekhne walo mien boat maqbool hua tha
3530,Positive,Agarcha aise artists mein Munni Begum aur Aziz Miyan qawaal ka naam bhi shamil hai
3531,Positive,karachi mai barish ki dua kar dain
3532,Negative,Orange T shirt to change karle bhai
3533,Positive,Salam Shuru k ramzan mai jo dua bataie thi 27 bar prhny ki to us ky mashallah buht faidy hasil hoy hy
3534,Positive,Kaash yeh hamare hukamrano ko bhi samajh aa jae aur adlia ko bhi Allah hum sab per raham farmae Aameen
3535,Negative,Band kar dain es programme ko or es beygharat Sahir Lodhi k ghr the mujrhy karain zara
