ID,label,review
4646,Negative,Janb Wala ap logo sy mara ek guzarish Hy meary Pakistan my agr kesy k sat koi zydty ho ja ta Hy to osko seda fire krka Mar Dy ta hay or muslman y or pir agy sy bary bary baty b kraty Hy or mai Na inuslt ky falny Admi ke or mai Pakistani qoom sy requeste kraty afiya hamry bety bhen be Hy or hamry maa Hy Kuch karo in ko chorao in ky laiy awz otao
4647,Positive,my favooorite one main iss dramein piche pagal hogayi hui hoon
4648,Negative,Question kapre kharedne se phele qimat malom karte hain Shahrukh Khan Nahi ameer hone ka ye matlab ye hai ke aap kisi dokan mein jayein aur ye fasla na kar payein ke donon mein se kon si T shirt ziyadah achi hai to phir donon kharid len aur donon mein se koi bhi na pehanne
4649,Negative,1939 mein jab Fazal ul Haq ne muslim league party ki policy par amal peyra na hote hue defense council ki rukniyat qabool kar li aur bad mein mustafi hone se inkaar kar diya to us mauqey par Hussain Shaheed Suhrawardy aur Khuwaja Nazim Uddin ne unke khilaf aik mahaz banaya tha
4650,Negative,alaikum Salam teekh hoon bas thora sa perishaan hoon mein college ki cheesay neya saal ka liye tyaar karna hai aur yeh saal bohoot mushkil ho go mera liye to inshallah accha karney ki liye dua karay merey liye
4651,Positive,Aur tm safai se kr jati ho
4652,Negative,Ma am Sameena Why should I pass you Me Ghareeb ki dua lagaygi maam
4653,Negative,Chat ki Tapish Ka Khatma Bina Tor Phor k Hr kaam Guaranteed
4654,Positive,Ye durust hai ke aik do martaba hum jeet ke kafi nazdik aaye magar har gaye to is ki wajah khuf aur dabao nahi tha
4655,Positive,Please dua kern Mery or mery husband K liye
4656,Negative,Bohat dukh hai un ka
4657,Positive,Very nice drama mout ka pagham dena wala abdullah
4658,Positive,Hi ap ka pic bat bat Acha hui
4659,Negative,Shershah amp Orangi Town Me Current Lagnay Se 5 Afrad Janbahaq
4660,Negative,anty zra holy
4661,Positive,Wo muaaf kar dene wale shakhs hain agar koi shakhs bilkhusoos koi mulazim ghalti kar bethta hai to wo ise yaksar nazar andaaz kar dete hain
4662,Negative,Muqadma PS Dharaksha Me Daraj Karain Ge Faisal Wada
4663,Positive,Apne kaam mein is tarah magan hoi ke mujhe khud bhi ye ehsas bad meinhowa ke koi undekhi lagan hai jo mujhe yun din raat masrof rakhe howae hai
4664,Positive,Molvi Abdul Haq ne Urdu ko Pakistan ki qaumi zanban banane ke silsile mein zabardast jid o jehad ki
4665,Positive,Jinhe bilamoom saraha jata hai
4666,Positive,Jis tarah un ki shairi anokhi hai un ke khotot bhi nasar nigari ken aye dor ka aghaz hain
4667,Positive,Karachi Ki Prime Location Per Mobile ka Karobar Kerne ka Nadir Moqa
4668,Positive,Saeed Anwar ne 247 one day international matches mein 39
4669,Positive,Yeh kahani inho ne sirf 20 ghanton mein mukammal kit hi
4670,Positive,Ye bhot he acha cantrolar he
4671,Negative,Kch nai her aik ki yehe khuwaish ha
4672,Negative,Us Ghareebi Se Panah Mango Jo Mayoos Kar Deti Hai
4673,Negative,ese toh mt keh itni mushkil se tera jor dhonda mene
4674,Negative,Aunty ko ab banda kya kahen
4675,Positive,EEE EEE Un ke likhe howae afsane aur qalmi khake adbi halkon mein aik khas shuhrat rakhte the lekin un ki manzil afsana aue khaka nigari na thi
4676,Negative,hahahah bs ab khatam wo meray liye 0
4677,Negative,Ishaq Dar K Aiwan Me Aane Tk Mamla Muakhar Kr Diya Gaya
4678,Negative,Jin logon ko mujh se jalan hoti hai wo jalte rahe
4679,Positive,lambi umer dey ap ko Ameen
4680,Positive,Tum Sab Mil Kar ALLAH K Samnay Tauba Karo Takay Tumhen Falaah Aur Kamyabi Naseeb Ho
4681,Positive,Allaha all Muslim ki muafi Qabul Kary or Mari bhi
4682,Negative,Sindh Govt Ne Nazimabad Under Pass Ka Mansooba Khamoshi Se Khatam Ker Dia
4683,Positive,Next time trophy apni a dont worry
4684,Positive,Pehla drama js me acha lg raha ye
4685,Positive,Hassan Husnain
4686,Negative,Aap ko aaj ye revelation hoi k shaid just maybe loog ratt k presentation dete hain
4687,Positive,Dosri aeham tip yeh hai ke aap ko apne bachon ke sath ziyada se ziyada waqt guzarna chahiye Log hairan ho kar mujh se pochte hain ke main ne
4688,Negative,Students Or Parents Ki Aala Hukkam Se Zid Chor Ker Jang Band Kerne Ki Appeal
4689,Negative,Bhai jaan chuti nai mili halkay main is say strong candidate koi nai ha
4690,Positive,Inho ne 37 test centuries banai hain aur is muaamley mein sirf Sachin Tendulkar se piche hain
4691,Negative,Qiyam Pakistan ke sath hi Pakhtunistan ke daye ho gae
4692,Negative,Model town ko Kashmir tum ny bnaya show baz drama
4693,Positive,Apnay kharchay khudd uthaa saknay wali independent aurat ko jo bghair kisi py depend kiye aur bghair kisi ki faaltu bakwaas sunay k g mein tou boht azeem aadmi hun k o biwi tumhara kharcha uthaa rha hun izzat k sath zindagi guzaar rhi ho ussay kehtay hain kaamyaab aurat
4694,Positive,11 saal ki umar mein inhone apni maa ko dekh bhal ka kaam sambhala jo shadeed qisim kay ziya diabetes mein mubtala thein
4695,Positive,Iss nazuk muqe par unhon ne apne hawas barqarar rakhe aur apne Shaheed sathi ki machine gun utha kar phir barsar e pekar ho gaye
4696,Positive,Maa cheez e ASE ha jis ka koi namil Badl Ni
4697,Positive,izat keya kr meri
4698,Negative,Bus brri ki qadar nae apko
4699,Positive,Hahha sabar kar allah sabar karna walo ka sath ha
4700,Negative,Kinza ko dafa ho Jana chahiya
4701,Positive,Cricket ki duniya ne ab tak jo azeem tareen player paida kiye in mein Brian Lara top of the list hain
4702,Positive,Thank you for sparing some time from Indian Film Industry
4703,Negative,Tere se wada tharki kahi dekha nai kia karun
4704,Positive,Janab Justice Iftikhar Muhammad Chaudhry aur aala adliya awami etemad ki dolat se malamal hain
4705,Negative,Nawaz chor family chor h
4706,Negative,Sylvester ki umer jab 9 baras hui to waldain mein alehdgi ho gai aur wo apni waldah ke sath rehne lage
4707,Negative,Khabaron mein rehne wali adakara Meera Valentine day manane Captain Naveed ke pas America pohanchen magar Naveed ki family ne Meera ko ghar mein dakhil hone se rok diya
4708,Negative,Dono couple khrab kr diye
4709,Negative,Laanat murtad kaminy
4710,Positive,Aap ne mulki adab ko nai jahton se roshanas karaya
4711,Positive,yaar apne mamaki id btaaa
4712,Negative,Yeh sab Kam manzur khanzeer ka Kam hay peshawar may belor shaheed Kia bolchistan may siraj rahsani ko shaheed Kia or Banu may akram durani par hamla Kia
4713,Positive,Inqelabaat zamana ne Iqbal Bano ki awaaz ko kabhi mutassir nahi kiya bal ke mazeed nikhaar diya tha
4714,Positive,Allah ki raza mandi ke bagir koi cheez hasil nahi ki jasakti chahe insan kitna hi yaqeen or nazmosabt ke saath hasil karne ki koshish karle
4715,Positive,Kafi comfortable hai pehnnay mein aur black color honay ki wajha sey ye har cheez par chal jati hai Main islye aksar ye hoodie pehnta hun liken shukar hai fitting waghera sub theek hai phr bhi
4716,Positive,Meri taraf se Uh k liYe
4717,Positive,Cricket ke bohat se qadamat pasand experts ne off stump ki janib yalghar karne ki Saeed Anwar ki kamzori par umgliyan uthai hain lekin sachi baat yeh hai ke jis batsman ne off stump ki bhol bhullaiyon par mabni gher yaqeeni duniya ko musakhir kiya
4718,Positive,Mein UK mein rahta hoon and app kay dars her waqt sunta hoon or bahhot khoish hey kay kisi din lahore tasbeeh khana akar aap kay pas beit kay kuch ilm hasil karoon
4719,Negative,2 Afraad Shadid Zkhmi Police
4720,Negative,Badalta hy Rang Asmaan kesy kesy
4721,Negative,Ye kya baat hui phle intrest jagate ho phir episode upload hi nhi krte
4722,Positive,in ki hum gair aur dair pa maqboliyat iss waqt samne aiye jab cricket ki sahafat kay sub say mutabar aur sub say qadeem adare wiz Dan nay cricket ki tarekh kay sub say maqboul all round ka tayeen karney kay liye sarwe karaya aur Imran Khan ka naam sar e fehrist ho kar samne aya goya Ian Botham Richard Hadlee Kapil Dev aur Jack Kalex all rounder aaj bhi in ki maqboliyat ka muqabla nahi kar sakey
4723,Negative,Saeed Anwar mein is tabdeeli ki wajah in ki chotio beti ki maut bani
4724,Positive,Jab Reham Khan se pocha gaya ke siyasat se qataa nazar Imran ko aur kya pasand hai to in ke kehna tha ke jab main is ghar mein aai to mera tassur kuch is tarah ka tha ke ooo hooo Imran ko to daal dalliya bhi thek tarah se nahi milta
4725,Negative,PS Kharadar K Bahir Awam Or Traffic Police Me Nok Jhok Jari
4726,Positive,Shadi ka na hona jadu ka toor bimariyan Shoar ko apna bana jumla masil ka rohani haal mojod ha mayoos afrad rabta kren masla hal ho jaen ga inshallah
4727,Negative,Har paper mein yehi gaana yaad aata hai
4728,Positive,aunty k lie meri taraf se aik chummi idhr aik chummi idhr
4729,Positive,In ke falahi kaamon ki aur Bosnia ki jangi qadiyon ke leye kaamon ki wajah se unhein United Nations ke High Commissioner baraye panah guzeen ne unhein apna khair sagali safeer muqarar kiya tha
4730,Negative,Mere leye duniya ke mamlat mein dilchaspi lena aur duniya mein barhne ki khuwahish karna sirf waldah sahiba ke dam se tha
4731,Negative,PIA saray PPP ka cota bara howa hay sealay Ghar beathh kar lay rahay hain
4732,Positive,Hum hun gay kamyab aik din
4733,Positive,Allah pak lambi umar dy
4734,Positive,Havaldar Lalak Jan Shaheed ne kaha ke wo hospital ke bistar par apni jan nahi dena chahate un ki khawahish hai ke un ki jan medan e jang mien kaam aaye
4735,Negative,Janay walay maut ki yaad dilate hain
4736,Negative,Unkay daur e hukumat mein Nawaz Sharif datkar unki mukhalfat kartay rahay
4737,Positive,Justice Retire Majida Rizvi bhi un basaor khawateen mein shamil hain jo mehaz apne leye nahi jetein
4738,Positive,Khandan ke jhaghron ka khush aslubi se tasfiya karati thein aur muhale ki khawaten mein bari maqbol thein
4739,Positive,Zaberdast sheesha Hai one liqua flavour bhe hai
4740,Negative,hamara tu yahan b nam nahi
4741,Positive,Aunti ny kamal kr ditta m fan o gae kasmay
4742,Negative,Landhi Labour Square Me Barish K Pani Me Doob K Bacha Janbhaq
4743,Negative,wo keh rahe hein k wo ghar pe nahin hein
4744,Negative,Maulana Kausar Niazi hamari siyasi tareekh ke wo aadmi the jinho ne mehaz apni salahiyat aur mehnat se aik maqam banaya magar wo zaati hesiyat mein khatir khuwa awami maqboliyat hasil na kar sake
4745,Positive,Khair mubarak allah pak ubqari k nizam ki ta qyamt hifazat frmaye ameen
4746,Positive,Yahan bhi Sarojini Naidu ke walid Doctor Aghomath ne in ka sath diya aur is ki parwah kiye bagher ke log kiya kahenge inho ne is shadi ki ijazat de di
4747,Positive,saalgira mubarak dunya tv
4748,Negative,phone acha hai laken gaming perfomence acha nahi hai dusra with out back cover use karna mushkel hai
4749,Negative,Hn mar loo jtna marna hn maro loo
4750,Positive,Shaam k liyea dowa karway
4751,Positive,Apne tibbi gudaz aur reham dili ki badolat Imam Bibi kisi ko musibat mein nahi dekh sakti thein
4752,Negative,Urdu zaban ke is azeem khidmatgar musanif aur muhaqiq ne 16 August 1961 ke roz Karachi mein wafat pai
4753,Negative,Supreme Court ke 9 arkan par mushtamil full bench ne Pakistan steel mills ki nijkari ko kaladam qarar de deya
4754,Negative,1980 mein suraj tolu hua to usney Waheed Murad ko aik nakam Mayous paraganda fiker aur jhunjlaey huay insan key roop mein dekha shohrat ki herjae devi ab Dhakey se aney waley nay Hero Nadeem par anayat ki barish ker rahi thi Waheed key puraney sathi Parvaiz Masroor aur Suhail jinhein khud Waheed nay raunat se thokra deya tha apnay apnay maidan mein kamyabyon key jhandey gar rahay they
4755,Positive,Mulk mein jab Zia Ul Haq ka marshal law nafiz hua to yeh Pir Pagara he ki koshishen thin jin ke sabab General Zia Ul Haq na sirf politicians se baat karne par aamada hote the bal ke inho ne mulk ko jamhoriyat ki patri par daalne ka wadah bhi pora kiya tha
4756,Positive,Allah pak inko hamesha salamat rakheyAmeeeeeeeeeeen
4757,Positive,Intikhab Alam Pakistan ki one day team ke phele captain hain
4758,Positive,Meri Meray Waliden Ki Meray Ghar Walon Ki Aur Momin Mardon Khawateen Ki Maghfirat Farma
4759,Positive,Wo khud bhi mutarannum the is liye inho na aesi lafziyat ka intekhab kiya jo ghanaiyat ke peykar par pore utarte hai
4760,Negative,ajeeb mixed ghussa plus laughter feels XD
4761,Positive,Ap bht ache ho
4762,Positive,1956 ke aaiyn ki tayyari mein mashraqi o maghrabi Pakistan mein masawat ka usool manwane mein Hussain Shaheed Suhrawardy ne nehayat aeham kirdar adaa kiya
4763,Negative,Itna bura na bolen ek din ap lOgo na bhi phOpho banna ha
4764,Negative,Logon nay do teen cheekhay kya maari aunty tou shaat he hogaye
4765,Negative,Wo pedal tornay main kamyaab rahay
4766,Positive,Hamare logon ki hunarmandi ka meyar bhi Thailand aur Dubai ki takkar ka hona chahiye
4767,Positive,mama ko zaroor thanks kahin
4768,Negative,Le das is bat py lakh di lanat tery tyyy aunty
4769,Negative,Allah parents ko bhi hidayat dai ke wo bachon ko aise programmes mai na bhaijen zainab ne sub ko jhanjhora hai jo jag gya wo nijat pa gya jo sota rha wo phr us din jagey ga jb
4770,Negative,Itni bizti
4771,Positive,Hahahahahaha Koi aye na aye end wala mehmaan laazmi aata hai
4772,Positive,Tmhari ami ko b
4773,Positive,Mera sb kch ap k lye qurban Allah meray Murshad ko Seht Ata farma in ka Saya ta dair hamaray uper qaim rakhna Ameen
4774,Negative,hahahaha lanat ho jhoto par
4775,Negative,Dekh Naa layy Punngaa
4776,Positive,Allah Kareem hazrat ko salamat rakhe ameen
4777,Positive,Is tournament mein kaamyabi se mere leye squash kheelne ki rahein khulti gayein phir bad mein na sirf Pakistan balke beron e mulk mein bhi junior title jeetne mein kaamyab raha hun
4778,Positive,Din K Duno Aur Raat K Kuch Hisson Me Namaz Qaim Karo Yaqeenan Nekiyaan Buraiyon Ko Mita Deti Hain
4779,Negative,fb hamesha sCh kehtu ha
4780,Positive,Yar wo jo start may left wali BANDI hay na BARI KAMAL hay CUTE
4781,Positive,behtree n sir boht pasand ayi
4782,Negative,Azad Kashmir K Sabiq Saddar amp Tehreek Azadi Kashmir K Baani Sardar Abdul Qayyum Inteqal Kar Gaye
4783,Positive,Allah ki hafiz hai
4784,Negative,Us waqat Chief Justice of Pakistan janab Justice Saeed uz Zaman Sidiqi aur kai dosre baradar Judge PCO ke tehat half uthane par taiyar na howae to unhen retired kar deya gaya
4785,Negative,mamu bhi muhn main khunganian daal kay baith gaya hey
4786,Negative,Sindh Hukumat Ne Administrator Karachi Saqib Soomro Samait Sindh K 10 Deputy Commission Ko Ohday Se Farigh Kardiya Gaya
4787,Positive,Kausar Niazi ki siyasi taqreerein majmey mein josh o kharosh bhi paida karti thin aur fikar o Danish ke nae dar bhi paida karti thin
4788,Negative,Lanat hay is byzameer anker per
4789,Negative,Chor bhaee tu
4790,Positive,Market sey thora sasta mil raha tha yehan tou main ney yehin sey ley lia apni baki items kay sath Quality bohat achi lagi kyunkay baalon kay liye healthy sabit hua aur split ends theek kar diye
4791,Negative,Chaudhry Aslam par mawara e adalat ke qatal ke ilzamat bhi lage
4792,Positive,Ahmed Faraz ki nazmon aur ghazlon ko aalmi Satah par shohrat hasil hui
4793,Negative,Koi soch b nahin sakta k itna bay hiss aur bay Zamir banda b hi sakta hai tuff hai
4794,Positive,allaha sp ko barkat ata lary
4795,Positive,Duniya e squash mein 2013 ke ikhtetam par un ki World ranking 48 thi tahum Nasir Iqbal ke azam buland hain aur bohat jald dunya ke top ten khilariyon mein shamil hone ke leye pori mehnat kar rahe hain
4796,Positive,Nasir Iqbal koshish yehi hoti hia ke mehnat Karen aura chi karkardagi pesh Karen
4797,Positive,ALLAH walay jo batya ja raha hai us par yaqeen kar lain us main sb kuch mill jaye ga
4798,Positive,Zabardast lalay Khush reh
4799,Positive,ALLAH Jisay Chahta Hai Qurb K Liye Chunta Hai Aur Apni Taraf Ruju Karnay Walon Ko Hidayat Deta Hai
4800,Positive,last one Paisa bohat ha Bohoot bohoot sara
4801,Positive,Kehti theen k is mahinay ki 31 ko mangni karne ka irada rakhti hain aur ye k Khuwaaroon k Badshah salamat ko bhi daawat thi
4802,Negative,Khul kay naachna Shah rukh ji nay sikhaaya
4803,Positive,Sir bi Imran Khan kaa sth dy rhaye ha
4804,Negative,pura semester time waste krte hain hmara srf
4805,Positive,Baqi sub venders sy sasta hai
4806,Positive,car ko saaf kernay ke lieya bohat kaam ata hai
4807,Positive,Allah Sub Ko Hidayat Day
4808,Positive,App b achi app ka dil b acha aur alaya ki kai baat hai
4809,Negative,Lanat
4810,Positive,Insha Allah main bohat jald quomi team ki numaindagi karon gi
4811,Positive,Mujhe is baat ki khushi hai ke main ne 2013 ke games mein infaradi tor par sab se ziyadah 8 gold medals leye the jo aik record hai
4812,Positive,Beta me apke liye stock exchange k papers bhejta hun kyunke apka interest lg rha hai issme
4813,Positive,please mjhe jitwa do ik
4814,Positive,MashaALLAH Jawan lug rahi ho
4815,Negative,Pagal jai na hoye reporter ka hath e le k beth gai
4816,Negative,Astagfurallah Ya Allah Reham kara
4817,Positive,Abhi bhi is ko behtar kiya ja sakta hai
4818,Positive,helo fahad bhai main ali aap ka sab se bigest fan kasam se i love u main aap se frendship krna chahta hoo
4819,Positive,Yun Shahid Afridi raaton raat gumnami se nikal kar aik super star ban gae the
4820,Negative,Jhootay Case Awam Ko Quaid Se Dur Nhi Kr Saktay Farooq Sattar
4821,Negative,Bilkul bakwas set hai Battery Charging boht slow hai Back camera Single hai aur wo bhi 8MP hai Net speed boht slow hai aur set hang bhi hota hai Overall ye set acha nhi hai
4822,Negative,69 Halakatain Hoin
4823,Positive,Mehekma Sehat Sindh Ne Taleemi Idaro Me Cigret Noshi Or Farokht Per Pabandi Aaid Kerdi Sheesha Cafe Bhi Band Karne Ka Faisla
4824,Positive,Great Man
4825,Positive,Allah pak maray murshad ke our maray murshed ke tmam alloulad our poray nezam ke our inke qiamat tak aanay waly naslooke sada hifazat farmay
4826,Negative,Liaquatabad Me Firing Se 1 Shaks Janbahaq
4827,Negative,Scene pe scene huwa
4828,Negative,Dukh ki baat yeh hai ke mouk ko azaadi hasil kiye nisf saddi se ziyada ka arsaa beet chukka hai magar hum is tamam arsey mein sirf aik Zia Mohyeddin paida kar sake
4829,Positive,New York times ne Malala Yousafzai par dastawezi film bannai
4830,Negative,Old City Areas Ki Markts Samt Shehar Ki Kayi Markets Bund
4831,Positive,Ap kon ho kaha sey aayy ho ap ki kis tarha tareef ki jay Mery pas alfaz nahi hai
4832,Negative,Aunty bik gyi hai
4833,Positive,Bomb Phat Na Saka
4834,Positive,achi bat hy
4835,Negative,Bdla lelia kro tm forn Rami jatuk
4836,Negative,tujhe dhakay de ke nikalungi ghr se
4837,Positive,Incharge Officer Slaughter House Dr Ghafoor Mengal Ki Nigrani Me Govt Slaughter House Me Bemar Janwaron K Gosht Ko Jalae Gaye
4838,Negative,Jalal Khan aj jalal me agyaaa ha
4839,Negative,khayal hai tabhi miss kar rahi hoon sirf
4840,Negative,Utility stores ki chini bhi mili bhaghat se aam dokanon par farokhat hoti rahi aur logon ko mehnghe damon milti rahi aur aj tak mil rahi hai
4841,Negative,Ajiya ne to rula diya aaj
4842,Positive,Bohot achy bandy
4843,Positive,sami bht ala yar
4844,Positive,umeed kis se lagayen
4845,Positive,isny b famous ho jana
4846,Negative,Us commotion ne General Asif Nawaz Jinjuwa ki muat ko fitri qarar diya jab ke bad mein ye baat sabit hoi ke unhen zahar deya gaya tha
4847,Positive,hahahah bht achy
4848,Negative,Bus is ki kami thi
4849,Positive,I swear mai abhi yehi Soch rae theee
4850,Negative,khun kay insaniyat ki khidmaat per Pakistan mein Institute of Business Administration say doctorate ki azarai digri di gai hai
4851,Positive,Now he is only one behind Pakistan record which is 7 on the trot by Intikhab Alam
4852,Positive,Cha gye ho dono
4853,Negative,shirts ache hain magar aik design ma do shirts nai hi no chahian design different hona chahian otherwise nice
4854,Positive,Is ke elawa aap ne apni sawanah umri par mabni teen kitabein marbaka memories of my childhood aur dairy of Selma Lagerloflik hein
4855,Negative,Saddaf Ahsan gusa ap ki soch per ha
4856,Positive,jo banda apne area k awam aur is mulk se mukhlis ha Allah kren wohi win kre chahay wo kisi b party se ho
4857,Positive,Aur mere khayal mein job hi ye zabardast combination pehan le wo fashion icon hai
4858,Negative,CM Sindh Ne Is Faislay Ko PPP K Khilaf Dhandli Qarar De Dia
4859,Positive,Mere murshad jesa koi nahi
4860,Positive,Pyar batne se barta hai to b bant
4861,Positive,Yahan tak ke steven ne 1 se 7 grade tak ki black belt hasil kar li
4862,Positive,Lekin sarojini English poetry mein dilchaspi rakhti thin
4863,Negative,daikhny ki ehmat jo na ki hum neeee p
4864,Positive,Ma sha Allah bhot khubsurat hain ap
4865,Positive,Yeh already para hai timeline pey meri iss mai sach hi itna hai k har koi tag kr rhaa haii aik dosry ko
4866,Negative,aur hm sb ise chor chuke hain isay
4867,Positive,Anmol khazana kahan say milayga
4868,Positive,Jab Tumhari Mushkilat Had Se Barhny Lagy To Samajh Lo K ALLAH Tumhy koi Buland Mukaam DenY Wala He HAZRAT ALI RA
4869,Negative,Twadi bahan noo l n waday police waliyaan dee noo Yaar dil kar raha hai sab police station ko bomb say uraa dey banda Laanat hai aisay qanoon per jo logoon ko tuhafaz deinay ki bajhaye inhein hi zaleel karay Aur Laanat hai aisay qanoon bananay waloon per bhi jinhoon nay apnay jaisay begairat corrupt loag barti kiye howay hain
4870,Negative,Shinging Angle fb pa upload ki ijazat ni hai fb pa srif promo upload karsakta hai hum log sorry
4871,Positive,Is ke bawajod World Cup par ane wale akhrajat aur stadiums ki tameer ke leye rihaishi elaqon ko khali karane par Brazil ke bare sheharon mein zabardast muzahire kiye gaye aur ye silsila jari hai
4872,Positive,Wo dekh saken ke main sanjeeda kaam karne ki aehal hon aur ab in ko mere kaam ke zariye he behtar jawab milega
4873,Negative,200 agree har is qisam k programme ko band kiya jai
4874,Positive,Almi satah par rosi khawateen ki is jurat ko saraha gaya aur Russia mein 8 March ko khawateen ka din qarar de diya gaya
4875,Negative,D ao shaheen mall p beth kr judge krain sbko D
4876,Positive,Ab Allah izzat rkh le batain to bht ho gaien
4877,Positive,Question Haliya dinon mein benul aqwam satah par aap ki karkardagi nisbatan behtar rahi hai aage kia tawaqoaat hain
4878,Positive,Kabhi Kabhi Mere Dil Mein Tera Khyal Ata hai Crackers Botter Naeem Tariq tk 3
4879,Negative,Pata nahi iss fahad mustufa k show sy kab jan chutty gee Ramzan main bhi bnd nahi hua yeh shetan Lga do baydardi
4880,Negative,Ya sardio main kam karta h
4881,Positive,Anay wale salao mein Edhi Foundation Pakistan kay baqi elaqo tak bhi phelti gai flu ki waba kay baad aik karobari shaksiyat nay Edhi ko kafi bari raqam ki imdad di jis say inhone aik ambulance khareedi jis ko woh khud chalate thay
4882,Positive,meri manzil
4883,Negative,Diezel chor
4884,Negative,Dil khoon k aansoo rota Hai dehato me log faqo se mer rae shehro me nokriya nhi Hai
4885,Negative,wo sona nai tha SAANP BICHO thy aqal sy farigh logo ko SONA hi nazar aye ga
4886,Negative,Bhai main in dono ma Se Kisi ka supporter nahi but ye baat admit krni pare gi k ganje k supporter s bhi ganje ki trh hi Hutiya Hain
4887,Positive,Apne ala khail se Hashim Khan ne poori dunia ko hairat mein dal diya tha
4888,Positive,QUETTA Alamdar Road Per Police Manshiyat Farosho Ke Khilaf Karwai 1 Mulzim Gariftar 1KG Chars Baramad 7 Heroni Gariftar
4889,Negative,Astagfurallah Ya Allah Reham kar
4890,Negative,Acha khali tind D
4891,Positive,Azeem uret dakhni h tu jamima ko dakho husband ki ezt kasy kerty us uret sy seekho
4892,Negative,g aa Mai end kr chori a
4893,Negative,ICI Pull K Neche Bomb Ki Itla Police Or BDS Talab
4894,Positive,roshan hai zameen roshan aasman mere mehboob qayamat hogi
4895,Negative,in ko agg lagy ge to pakistan main roshni ho ge
4896,Negative,Insaf Ki Fori Farahmi Me Nakami Ka Aitraf Karna Chahiye Nizame Adal Me Behtari K Bajaye Kharabi Aai Chief Justice Jawwad Khwaja
4897,Negative,Wo chijo ldkio wali nai chutiyo ldkio wali hai
4898,Negative,Jab iski kisi nay ice cerem ma zehar dia tha jab he mar Jana chaie tha is haram khor ko isko deen Kay baray ma be batao itna makeup kar k ati hai bager nakap k ye be too galat h
4899,Positive,ketry jo aa
4900,Positive,mzyy ka Hai naa
4901,Positive,Love this song
4902,Positive,Arey yaar itna mai life me kabhi nahi hasa
4903,Negative,Pakistan ki team aik inning mein to sirf 62 runs bana kar out hogai
4904,Negative,Punjab ko bnane mein Nawaz Sharif ka bohut bara hath hai
4905,Positive,MashaAllah Very NiceBut Hifzia Chachudary nahi he to acha nahi lag rha
4906,Negative,beghairt m n konxi exi ghlazat wali bt ki mnhosay D wo tw ek dafa mu s nikl gai thi mere D
4907,Negative,Sirf sahir lodhi hi kion nida Yasir ne b apne show main nach gane ka programme raka hai
4908,Negative,Akhtar tmhara bs duppata ya shawl hi lo to tm icc sa b dus hath aagy jati ho
4909,Positive,Ky howa in ko ya to sat yab he hn Mashallah
4910,Positive,Jab un ke pehla shaiyri majmooa EEE EEE Tanha Tanha EEE EEE shaey hua to wo BA mein the
4911,Positive,Autograph milay ga zroooor milay ga
4912,Negative,Aik Poor Patient Ko Blood Ki 12 Botles Ke Sakhat Zarorat Hai
4913,Negative,Mere kayal mein is qism ki dressing ke leye kafi himat ki zarorat hoti hai
4914,Positive,naujawan Mohibullah ne apne tajurba kar mamoon ke khelaf lajawab khail ka mozahra kiya
4915,Positive,Hum degar mumalik se madad nahi tijarat karte hain is waqat zar e mubadla ke zakhair 21 arab dollar ho chuke hain
4916,Positive,NI MAAF KE DO MJHEE ME AISE HI THEEK THI
4917,Negative,Lanat ap pe bari wali
4918,Negative,tera hu ulta hasaab ha
4919,Positive,ALLAHA PAK na apny ghr or Quran ki protection ki responsibility khud li ha INSHA ALLAHA Wo sb ko naik kam ki hidayat nd tofeq dain ga Ameen
4920,Positive,Murshid pak achi jga job k liye dua frma dain
4921,Negative,Takra to hona hia Lakin partition Wala seen to Ni hia Jo log generalize kr rahey hian
4922,Negative,Allah gharq kare police walon ko
4923,Positive,Product buht acha hai aur quality bhe buht zabardast hai
4924,Positive,Habib arain AK magwa kr do plzzzzzzzz Eid pa
4925,Negative,Is show ko ban ki jaaye
