ID,label,review
1662,Negative,Landhi Sec 36B Me Guzishta Rat Se Bijli Gayab Bijli Na Hone Se Pani Ki Qillat Elaqa Makeen Pareshan Hukkam Se Notice Ki Apeal
1663,Positive,Bollywood ki ek flm PEHLA SITARA jo iltiwa ka shikar chali ja rahi hai ye ek choty budget ki film hai jis mein ek naye hero ke saath markazi kirdar ada kiya hai Adakara SONAL CHAUHANany ek interview mein kaha ke kamyabi ya nakami ye to zindgi ka hissa hai lekn bollywood mein career ka aghaz kamyab film se hona anyl iey aizaz samajhti hun
1664,Positive,Inho ne 62 baras mein shadi ka faisla karne se pehle yaqinan achi tarah ghaur o fikar kiya ho ga
1665,Positive,Allah pk apna khas karam kry in par
1666,Negative,Jin se inho ne lakhon dollars kharch kar ke jaan churai hai
1667,Negative,Pvt School Management Association 3 Aug Se Schools Kholnay Per Dati Hui Hai
1668,Negative,Baqaul Saeed Anwar agar ALLAH TA ALA mje apni taraf na bulate to mai shayad dewangi ki had tak ja pohanchta
1669,Positive,Tribunal ne apne faidley mein is haqiqat ka izhaar kiya ke Musalmano ne fasadaat mein jarhiyat nahi ki thi
1670,Positive,khair Mubarak g hazart Saab aap ko aur aap sari teem ubqari ko ALLAH aapne Hafez eaman main rakhey aap ko ta hayeet salamat rakhey border ALLAH bless you murshad g
1671,Positive,Baba e Mlolvi Abdul Haq ne Urdu zaban ki esi khidmat injam di jis ki missal dosri zaban ki tarikh mein nahi milti
1672,Negative,Guzara hy ye phone bsss
1673,Positive,Tumari shadi 2 saal baad hogi wo b achanak kisi czn se
1674,Negative,Army This is NOT a war this is genocide
1675,Negative,Mar ly tu bsss
1676,Negative,19 March 1994 ko is hasht pehlo shakhsiyat ne daarfani se kooch kia
1677,Positive,Shokat Khanum Me 70 Mareezo Ka Muft Elaj Hota Hai
1678,Negative,Keh hasil kuch nhi hota ksi ko azmaany se
1679,Positive,aunty bohat samjhdar lagi raheen
1680,Positive,Maroof actress model Mathira ne 2014 mien apni all rounder performance se showbiz ke mukhtalif shobon par raaj karne ka aelaan kar diya
1681,Positive,Sheikh saaab Allah pak ap ko khuss rakhy
1682,Positive,dil me khud aaka ho nala jm hai akbaal sjdo me pde rahna rahne se jnnat nahi milee yhi likha hai bahi
1683,Positive,Love u lhr
1684,Positive,Ahreee umeed Imran khan
1685,Positive,Logun k dil badalny k lye inka eik jumla kafi hi
1686,Negative,Alhamdulilah kia kruu tmhary sath rh kr ye halat ho gae mere
1687,Positive,aunty ka bhot bhot shukriya krdena meri trf se
1688,Positive,Amrica key saf e aual key khaelari Mark Talboot sey iss dauran inn ka 13 moqabla hua aur inn mein sey 12 mertaba Jahangir Khan ney kabyabi hasil ki
1689,Positive,Un ki tez nigah bohat jald mamle ki the tak pohanch jati aur wo fasla sunane mein takhir na karte the
1690,Positive,Un ka aik aur tarika ye tha ke muhale ke gharib gharanon ki das bara saal ki teen char bachyon ko apne han le atein aur un ki kafeel ban jatein
1691,Negative,Ek mint is se pehly indian movie channels khatam kardiye jain Is sahir ka to itna role hi nhi hai sahir lodhi ko kon dekha hy 1 cror log approx llekn indian movies aur dramas ko dekhny walon ki tadad 18 ya 19 cror hy to unko band kiya jaye sb se pehly Internet pr b ban lagaya jaye unho ny zada masla create kia hai
1692,Positive,Pak Afghan Sarhadi Elaqay Raajgal Sector Mein Fizai Karwai 2 Khudkush Bombaar Samait 15 Dehshat Gard Halak
1693,Positive,Boht khoob
1694,Negative,Yousaf Abdul Qadeer exactly geo bas ratings ki fikaar karta hai
1695,Negative,Pak Ko Ye Yad Rakhna Chahiye Ky Agar Bharat Ka Aman Mutasir Hoga To Cricket Nhy Hogi Says Anurag_Thakur
1696,Negative,Chagharzo Me Sowari Jany Wali Gadi Per Firing 5 Afrad Jan Sy Gaye Kai Zakhmi Donu Groupo Ka Taluq Zillah Shangla Sy He
1697,Negative,sara rat bat ka phara jo sir na phara ya wo khuch bhi aya
1698,Positive,Television ke nazreen mien wo actor ke sath sath bataur meyzban bhi boat maqbool the
1699,Positive,final mein bhi unhon ne bahot zaberdast khail ka mozahra keya megar un ke mamoon ne apne tajurbe sey faida uthate hue bazi jeet li
1700,Negative,Uss dour k sultan se koi bhul hoi hai
1701,Negative,Bc dekh tera status
1702,Negative,All Karachi Taajir Itehad Ki Aaj Honewali Hartal Ki MQM Ne Himayat Ka Elan Kardia
1703,Negative,I buy it dikhne me bilkul pic jesi he but fabric bht kharab or stitching very bad first time me hi silai khul gai or kapra bilkul dheela hogaya medium se large hogai very bad aybeez Read more
1704,Negative,Allah ham sub ko him at or gerat dye
1705,Positive,Buri bat achhy bchchy galiyan nhi dety
1706,Negative,Main ne Jo order kiya wo shirts mujhe nhi bejhi simple colour black green and white bejh di galat chezain dene lag Haya hai ye seller
1707,Positive,Shahrukh khan falahi kamon aur imdadi sargarmiyon mein bhi hissa lete hain
1708,Negative,Manzur khanzeer ka or us ka faltoo koto ka ilaj serf pak army hay
1709,Positive,Waise team ke logon ne to bohat tareef ki hai jis se mera hausla barha
1710,Positive,Is tarha District Court mein apni practice jari rakhte howae main ne senior Judge ke sath family laws par kafi kaam kiya
1711,Positive,Pakistan mein agarcha siyasi shakhsiyat siyasi utaar charhaho se mutassir hoti rehti hain lekin Pir Pagara ke siyasi asraat ko kabhi zawaal nahi aaya
1712,Positive,Ibtedah mein Raghib Murad Abadi ke samne zaanoey tilmiz tey kiya
1713,Negative,Yar still yhi haal h mera
1714,Negative,ShayAteen A Gae Maidaan may
1715,Positive,great inspiration
1716,Negative,Mulk mein khawateen ko beshumar mashi aur samaji masail ka samna hia
1717,Positive,Dj yar fees bht kum leta ha bary bary kamon key
1718,Negative,Yehi nahi bal ke paidaiysh ke waqt stallone ke face par scissor lagne ki wajah se face ka aik hissa waqti taur par maflooj ho gaya tha jis ke asraat aaj bhi in ki zabaan aur face ke aik taraf maujood hain
1719,Positive,Her insan per farz hai eid ki namaz se pahley pahley
1720,Positive,Dua kar day Allah mujay zati rahish atta farmay Ameen
1721,Positive,Muneeza our second day of eid D
1722,Positive,Billa akhir 1955 mein Inayat Hussain Bhatti ko film Heer mein hero ke tor par kaam karne ka muqa mila aur golokari ke sath sath un ki adakari ko bhi khasa saraha gaya
1723,Positive,Bohottttt Khubsurat he waqae Jo maza Wahan jakr dekhne mn he Wo ese nahi he Zindgi K Khubsurat lamhat the Wahan K Really missing Skd alot
1724,Negative,DG Rangers Bilal Akber Ne Hangami Ijlas Talab Kr Lia Mojuda Surat e Haal Ka Jaiza Lia Jayega Ijlas Mn Ahem Faisle Mutawaqa
1725,Negative,Or tum ho hi gandi nasal k
1726,Negative,Maflooj awam hai janab yeh ab
1727,Positive,Jinhe beyk waqt Urdu aur Punjabi films mein kamiyabi mili thi
1728,Negative,afghanstan boder ko seel karna chhahey wahan say teriorst aatay jaatay hai aur ain ko wahan say suport be miltey
1729,Negative,Ghalat hai yeh
1730,Positive,Mujhay iska print bohat pasand aya bohat nafees aur khubsurat print hai Kurit kay sath tasweer mein dekhaya black trouser bhi add karna chaye ismein
1731,Positive,MashAllah Allah buri nazer sy bchayn
1732,Negative,Nhi ho rha adjust
1733,Positive,jemama smith nay shadi say phelay Islam qaboul karliya tha in ka Islamic name jemama khan hai
1734,Positive,Mulk Me Dehshat Gardi K Tamam Networks Khatam Kar Diye Zarb e Azb Me Ab Tak 1914 Dehshat Gard Maray Gaye Wazir Dakhla Ch Nisar
1735,Positive,online b ap bat ho sakatay hain website par form fill kr k aur akhri ramzan k akhir main b online bait kiya jaye ga ap apne masyal k hal k lia har waqt ya musabibal asabab parhty rahain khula hazaron lakhon ki tadad main aur website se dars sunain 70 se 90 in sha ALLAH apkay masyal ALLAH hal kr de ga
1736,Negative,Imran Khan 3 Mahinay Ka Dharna De Saktay Hein To Hum 6 Mahinay Ka Dharna Den Ge
1737,Positive,Jo wife ko apni pay k mutabiq kharcha krae wohi kamyab mard hy
1738,Negative,Bht bura haal tha iska
1739,Positive,Allah aap ki Hifazat karay IK
1740,Negative,Bc paper mai he bhand na marr de
1741,Positive,HahahahahaH hansi ni ruk rai comment pardh k
1742,Positive,kamzor ankhon kay liay yeh bari achee aijaad hai Ankhon pe isko pehnn kay zorr kam parhta hai Lens ki quality bhee achee hai aur labay chalne ki umeed rakhta hoon kiunkay achi quality per mustamil hain yeh
1743,Negative,Badshah salamat si sir mujhe milay hain cheethray circuit k
1744,Positive,itny mazey se gari ti mein
1745,Positive,Hussain Abbas yaqeen se hi har wazeefa krti hon ab agy Allah ki marzi
1746,Negative,Ooh my God my dear I purchase same helmet from from market in just 2300 rupees Allh ka khouf kro
1747,Positive,Bilquis Edhi ke naam se kon waqif nahi
1748,Negative,aunty ne tumhari wo mari wo mari hy k maza aa gya 1 wari fair sheir aunty ummmmmmmmahhhhhhh
1749,Positive,Allah pak salmat rakhy ameen
1750,Positive,Allah pak hazrat ko Lambi umar De
1751,Negative,PM Nawaz Sharif Ka Chief Justice Ko Khat Justice Jawwad Se Bullet Proof Gaari Na Lainay K Faislay Per Nazar e Saani Ki Darkhwast
1752,Negative,Agar ham aram se ghar baithy tamasha daikhein ge tu phir khuda hi hafiz
1753,Positive,FIA Ka Chapa Facebook Par Khatoon Ke Naam Se Jaali ID Bana Kar Doosron Ko Bewaqoof Banane Wala Muhammad Sadiq Griftar
1754,Positive,Ubqari say meri zindage Badal gaye hai Allah tazbikhanay par apne rehmat ke badal barsaye or Allah hakeem sahab ko lambi omer naik amaal ke leye ataa farmaye Ameen
1755,Positive,1971 mein Sire county 13 saal bad county champion bani to us mein Intikhab Alam ki umdah bowling ka bhi dakhal tha
1756,Positive,Thakawat naam ki cheese se to who waqif hi nahein they
1757,Negative,Lakh lanat jahanmi
1758,Positive,Dabba Khali is liye ho ga kyun k tum kha chuki ho gi na
1759,Negative,CM Sindh K Shikway K Bad Sindh Govt K Khilaf NAB Or FIA Ko Karwai Se Rok Dia
1760,Negative,Noon league nay as usual Sirf credit khod Lia hai
1761,Negative,na kru yrr kinza my fvrt hy
1762,Negative,meri bal bht jhr gai hi or kafi gape aa gya hi aap aisa koi totka btai js si bal fr si aajai plz
1763,Negative,gnda shks hai hai ye
1764,Positive,Mar ja Tu ty ha e ni meri
1765,Positive,ama ko thanx kehna apni
1766,Positive,Mera dada ka bachpan ka ghar Bhati gate ke saamne bhi hai Yeh acha hai main paise kumar raha hun taake phone le lun iss saal
1767,Positive,Filhal to Bollywood ki aik film ke liye baat chal rahi hai us ka subject bohat acha hai aur yeh Deepti Navil ki film hai
1768,Positive,Jesi tumhri pasand wesi hi meri btw i like his hairstyle
1769,Positive,Tum Meray Dunya Me Ghaar K Sathi Aur Aakhrat Me Houz e Kausar K Bhi Sathi Aur Rafiq Ho Gay
1770,Negative,Amir liaqat ko ban kya jA sakta hAi Sahir ko nahi
1771,Negative,Dharnay hotai
1772,Positive,Inho ne Zia ul Haq ki Amriyat ke khilaf nazmein likhi jinhe bohat shohrat mili
1773,Negative,D ahan nAi nAi kachra rani to aAp pe suit karta ha
1774,Negative,In k demagh mein b kachra bhara howa h
1775,Positive,sach kaha ap nay Agree
1776,Positive,Main apne tamam fankar sathiyon ki izzat karti hon aur in ki shandar performance par in ko mubarakbad deti hon
1777,Negative,Molviown ka selaab jama awaam ka selaab nikalta
1778,Positive,Is baat par Reham Khan ne muskurate hue kaha
1779,Negative,Milna tumhen chahyey tha The real blackmailer awarddd
1780,Negative,Hm sa to parhya hua paper bi pora attempt nahi hota
1781,Positive,Havaldar Lalak Jan ne aik barod ka thela pusht par bandha aur AK 47 sanbhal kar Bharti gola bari ke darmiyan tiger hill se utre aur kisi ki nigah mein aaye bagheir khofiya banker tak ja pohanche
1782,Positive,Shakhsi sehar ke lihaaz se bhi Johnny Depp kisi dosri celebrity se piche nahi
1783,Negative,Logon ki be inteha dad hasil karne ke bawajud adab ke thekedaron ke zere atab rehene wala Saghar Siddiqui 19 July 1974 ko khamoshi ke sath shehar e khamoshan Ahata e Sheikhan nazd Surriya Azeem Waqaf Hospital Bahawalpur road qabrustan Meyani Sahab Lahore mein dafan ho gaya
1784,Positive,Hahaha kiya debate thi last main jo aunty bol kr gyi hain woh kamal ka dialogue tha
1785,Positive,Love u Qalandars
1786,Positive,Iss ke baad Jhangir Khan ke walid Roshan Khan aur bhai Torsam Khan kamyabian hasil kein te rahe
1787,Positive,Done Thanks Urdu Safha s Admin for such initiative
1788,Positive,Baat kardi aunty ne Dil jeet lia phr bhi mein Imran ko vote dunga
1789,Positive,Abdu ke qanoon ke tehat Hussain Shaheed Suhrawardy par muqaddama chalaya gaya chunache tribunal ne samne pesh ho kar aap ne apna case aise madlal aur asar angez andaaz mein pesh kiya
1790,Negative,Aunty six mar k chali gai
1791,Positive,Javed Miandad Asif Iqbal ki hamrahi inning ka agaz kiya aur apne phele hi match mein 163 runs ka bara score bana dala
1792,Negative,Bach ke rahna Usse
1793,Negative,Lantiiiii khuda k azab h tum pu kutyyyy
1794,Positive,ALLAH Dekh Raha Hai
1795,Positive,Jab school teachers ne in ki awaaz suni to Mukesh aur Rafi ke songs ki farmaiysh karne lage aur hausla afzaai karne ke sath sath yeh dars bhi dete rehte ke singing na chorna
1796,Positive,Jahangir Khan apne barae bhai Torsam ke khail sey bahot motasir they
1797,Negative,Tahum in ki kuch films nakaam bhi hui hain
1798,Negative,Liaquatabad Sindhi Hotel K Qareeb Rangers Ka Search Operation Shuro Ghar Ghar Talashi Dakhli Kharji Rastay Bund
1799,Positive,hakeem sahab dua kre allah mjy jld olad ki nemat or tehmat sy nawaz dy ameen
1800,Positive,hahaha Jani ma bhi wo hee kha Raha hu
1801,Positive,Allah sab musal mana ko hidayat de
1802,Positive,Jisy ALLAH rkhy usy kch nhi ho sakta
1803,Negative,Firing Or Pur Tashadud Waqiat Me 54 Afrad Qatal
1804,Negative,Jin arkan ne apna haq e raidahi istamal nahi kiya in mein Mulana Azam Tariq Owees Laghari Raja Khalid aur AmanAbbasi shamil han
1805,Positive,Allah kamiyab Karen
1806,Positive,Achi karkardagi ki bina par unhen sirf 6 mah baad hi Qasim Platoon ka commander muqarar kar diya gaya aur agle hi saal bator boy company commander taraki de di gai
1807,Positive,Maut ke 45 baras bad marhoom ko hukoomat Pakistan ne hilal imtiyaz ke aezaaz se nawaza
1808,Negative,Daikho ghairt kro ye muslim bacha es bat ka saboot de gia k hum zinda hein
1809,Positive,Finally arsal ko b pata lag e gya jiya ki feelings ka
1810,Positive,Shayad iss liye ke Waheed Murad ki zati kahani aik mokammal aur kamyab almeay kay tamam anasir khud mein samoye huye hain
1811,Positive,Press culb mein pur hujom press conference mein Meera aur Naeem Ghuman ne dastawez par dastakhat kiye
1812,Negative,Jis ke zariye awam ka arbon rupiya loot le jane wale thag aik dosre ke jaraiym par pardah daal rahe hain
1813,Negative,agli baar koi kry toh aoskae stomach pe zor se pinch krien
1814,Negative,O mere bhaio ea videos dekh k kamaka insan ko mout se darao mat
1815,Negative,Nahi mila
1816,Positive,To zat ka hai syed or ma tumra nokar
1817,Negative,Video puri daikh kr tharki imaginations imagine kr ky end mey usy dubata karwao khud ki soch nangi ley ghoomo
1818,Positive,Subhan Allah Kia bat he mere Mola mere Rab ki Rahimi or Kareemi ki
1819,Negative,bkwas poor quality so bad
1820,Negative,humse na hou paaye ga
1821,Positive,Speed achi h aur mera dslr ka card sahi chal raha h
1822,Positive,Mout Har Hal Main Aani Hain
1823,Positive,1987 mein Johnny Depp ko maqbool TV show Jump Street 21 mein kaam karne ka mauqa mila jis ke bad kamiyabiyon ke darwazey in par khulte he chale gaey
1824,Positive,Hahahhahahhahaha pyar krtay ho na Aap es se aur mujayy btyaa bhe nai
1825,Negative,Had kardi AP ne had krdi ap nd
1826,Negative,Ye lanti khud America or India ka Agent ha ye Kiya fesla krey ga
1827,Positive,wo design nai mila Jo oper pic main dikhaya gaya mager Jo mila hy wo b acha hy kapda good quality ka hy
1828,Negative,Bht shouq hai tujhe phasne ka Aik bar agai shakanje main toh tumhari khabast aur tumhari hassi dono ki waat lgaa doonga main
1829,Positive,Malala Yousafzai ko Pakistan ka phela ezaz bara e aman diya gaya
1830,Negative,Khudiii kO keh ri hoo
1831,Positive,Meri ankhon m pani aa gia
1832,Negative,Afsos ki bat hy zahru hm bh kitny dhet hy th0ri dair bad phr agae thy maf tu hm ne kisi hal me nh kia tmhen
1833,Positive,Judge bartaraf howae gharon mein nazar band howae lekin awam ki taqat ne khud ko manwa leya
1834,Positive,Brian Lara ko first class cricket mein yeh aezaaz bhi hasil hai ke wo aik he innings mein 501 runs banane wale wahid batman ban gae
1835,Positive,sb se ziada shugli glasses mei white shalwar qameez wala he
1836,Positive,Mashraqi Pakistan mein fauji karwai ke khilaf inho ne aik nazam mushayare mein parhi jis ke ibtedai misrey ye the
1837,Positive,kaha na yaad aaty ho tu bus yad aaty ho
1838,Negative,Quaid MQM Altaf Hussain Ka Rangers Operation Per Awami Referendum Karane Ka Mutalba
1839,Positive,app ko dua denay k lye mere pass alfaaz nahi
1840,Negative,aawaz bohat kam hy
1841,Negative,Aunty ki date of birth pay lannat aur pechay Jo bandari k bachay bhaith k clapping kr rahay h woh woh qoum h Jo ghr daal k paisay dai k jati h to wapsi pay ghr chota ghoust paka hota h
1842,Positive,Wazir e Azam Ne Party Rehnumaun Ko Captan K Zati Mamlay Pr Bayan Bazi Sy Rok Diya
1843,Positive,Janab Hashir sahab aur Badshah Salamat ne exams k baad is project pe kaam shuru kiya
1844,Positive,Bilkul jaisa picture mai dekha tha waisa he product tha ye aur mjhe boht pasand aaaya Iski quality bilkul A1 thi aur mai iss cheez se bhi mutmayeen hun ke iski description bilkul sahi thi website pe
1845,Positive,allah jaza dy ga
1846,Negative,sp agree krte ho aunti dosri shadi karen
1847,Positive,Un hi ki rafaqat ki wajah se 13 saal ki umar mein Nisar Bazmi nohat se ragon par abor hasil kar chuke the
1848,Negative,Is k sir kalam kardiya jaha
1849,Positive,Meri chahat
1850,Positive,tmhari eid
1851,Negative,Abi tk to koi frq nae pra 3 bar use kr lya aagy dekhty hain kya hota hai
1852,Negative,Ajeeb ittefaq hai ke Rashid Minhas ke Grandfather Abdullah Minhas bhi 20 August 1934 ko baroz Jumma tul Mubarak 11 45 par inteqal kar gaey tha
1853,Negative,FIR kataygi ab
1854,Positive,App paidaishi leder thay aur shuro say hi apnay doston ki chote chote kamo aur khel tamashe karne per hosla afzai karte thay
1855,Negative,q nhee deta zra dleel tou dein deen sirf ejazat hi nhee deta blke bolne walo nko ajr o swab bhi deta hai lgta hai aap ko blawel ki chamcha geeri ka bht shoq hai
1856,Negative,Funny bnay ki nakam kosish
1857,Positive,Good news ha
1858,Positive,Waldah ne jawani hi mein apni zindagi falahi kaamon mein waqf kardene ka ahad kar liya tha
1859,Negative,Han kher demag wale jo hoe tum log
1860,Positive,Chal bata selfie LA LA ray
1861,Positive,Inayat Hussain Bhatti kai ghareb bachon ko taleemi wazifa dete the
1862,Positive,Qoumi Watan Party KPK Hkomat Main Shamil
1863,Positive,Good geftr krdo
1864,Positive,Pani Chori Ki Saza 10 Sal Or 10 Lakh Jurmana Hoga
1865,Negative,Kuch ni jahil awam larkian nachany se agay ni ja skti
1866,Negative,Political disability Tu aysa insan ko mulk chalana dena cahiya in ka hisab nahin hona cahiya kya soch ha yar teri
1867,Positive,Bhai scene on ha
1868,Negative,Mujhy b ni mily
1869,Positive,Hashim cheete ki tarah phurti se gaind ball per lapakte they aur aise qabil e deed strokes khelte they is ka tasawar bhi mumkin nahein tha
1870,Positive,Iss soch ne unhein South Asia ki aik nehayat qabil ziker tahreek khodai khidmatgar tahreek shuru kerne par majboor kiya
1871,Positive,sun lo tmhy meri or kiran jesi frnd he chahye haina
1872,Positive,Duva main yad rakiya ga
1873,Positive,app ki kamyabeon key eteraf mein app ko sadarti temgha barae husn karkerdagi sey nawaza gea aur Canada key aik adarey ney un ki zindagi par Fatha nami aik film bhi taiyar ki
1874,Positive,Dono ustadon se thumri aur daadra samait classical singing ki barikiyon se aagahi hasil ki
1875,Positive,Allah khair kry ga
1876,Positive,shukriya jee
1877,Positive,yar jani mil na h m missing u bht sari punchad h karna ko
1878,Positive,Thanks boldenA meri taraf Se
1879,Negative,Bhai koi us becharay ko tou batao
1880,Positive,Nasar kazmi Was a great poat
1881,Negative,cheez bari hai maste
1882,Positive,1992 ke bad inhe cricket ki duniya ka sab se ziyada tez aur sab se ziyada tabahkun bowler qarar diya jane laga
1883,Negative,Isko dekh kar accounts ke test yad agai
1884,Negative,bchary k daant to pury lgwa dy
1885,Positive,Aik taraf to inhe marshal arts se na sirf qalbi lagao hai bal ke wo judo ke mahir black belt 6 dawn bhi hain
1886,Negative,Mushtaq Manhoos ki misaal aisi ha jaisay kehtay hain dhobi ka kutta ghar ka nah ghaat ka
1887,Negative,Double minded ppl toh dekhey they double mouch abba pehli dafa dekha
1888,Negative,Zilla Aur Tehsil Councelon Ki 242 Nashiston Par Dubara Polling Hogi
1889,Negative,Intikhab Alam ke baqol baz khilari sochte the ke agar mein beron e mulk series jeet gaya to najane kia ban jaon ga
1890,Positive,Yahi h mera saccha dost
1891,Negative,Razia Sheer Khan Humare mulk ke bare shearon mein tartan track to hain lekin is ki maintenance nahi
1892,Negative,Emma Watson khud ko romance mein bad qismat samajhti hai
1893,Negative,Begart log secand hand products sell kar rahy in ko daraz sa nikal dana chay bludy peoples
1894,Positive,Jo box office par hit sabit hui
1895,Positive,Allah salamat rakhe
1896,Positive,KU BA Bcom Pvt Annual Exams 2015 K Liye Forms 31 Oct 15 Tak Jama Karwa Sakty Hai
1897,Positive,Woh hukumat ya sabqa mazhabi jamaton say imdad bhi nahi latay khun kay woh samjhte hain kay in ki imdad mashrot hoti hai
1898,Negative,ach sory muh seda
1899,Positive,Meri karkardagi bhi sab ke samne hai aur mujhe selectors par etemad hai
1900,Positive,In ki shaiyri mein bar e sagheer ke manazir ki tasveer hai aur in ki shiayri mein Hindi aur Urdu ki bohat khoobsurat aamesizh paai jati hai jo mushtarka riwayat ki tasveer hai
1901,Positive,Good
1902,Negative,Allah pak k gher ko dekh ker jo dily sakun milta hai wo bohet badbakhat hai jo ye lanty herket karta hai
1903,Negative,Ahmed Nadeem Qasmi ne 1948 mein adbi magzines EEE EEESawera EEE EEEshuru keya1948 aur 1949 mein Peshawar Radio ki nokri chor ker woh Lahore wapis agaey aur adbi resale Naqus ki adarat shuru ki
1904,Negative,yhi wo patwaari hy joh samjty nhi k bacho ko roads nhi chahiye hospitals chahiye schools chahiye
1905,Negative,Khi M A Jinnah Road Numaish Chourangi Tibet Centre Jama Cloth K Atraf Ki Galiyan Barrier Laga Kr Bund Krdi Gyen
1906,Positive,Yar ajkl sakht pareshan hu rozgar ki fikr me bht acha lga parh k
1907,Negative,haa ma b disi kehri khbr stuff khrb huje par dost ghurayo aa disa unjo kiye nikryo
1908,Positive,koi hal ni
1909,Positive,Is liye ke hum kamiyabi ke muqabley mein apni nakaami se kahi ziyada sabaq seekh sakte hain
1910,Positive,Bht khoob
1911,Negative,Bhai masiny ki bat hoi Ap sy better masoom shakal koi bna e nh skta
1912,Positive,Tahum in ki shohrat mein in ki fankarana salahiyaton ka bhi barha dakhal hai
1913,Positive,Rafeeq Peer Theater ke leye un ke gaye howae naghme aaj bhi mashor hain
1914,Positive,bhai ye drama buhat acha hai ghr mai ek episode chal rahi thi dekha tha maza deny laga isliye ab dekhta hon
1915,Negative,Kitna tang kiya tha usy
1916,Negative,Aisee aurtain hoti hain jo matti ke tail ka choolah phatnay se marti hain
1917,Positive,tab Iqbal Bano ke shauq ko ustaad ki raae ne jilaa bakhshi aur inho ne apne aehal e khana se kaha mujhe gana seekhna hai
1918,Negative,Koi b nai fazol hin sab
1919,Negative,Ab ye halat hai ke mout ka intezar hai
1920,Positive,Allah Sada Salamat rakhy
1921,Negative,Apni uktahat aur bechaine door kerney key leyeh Waheed Murad nay intehae taiz raftari se car chalaney ka mashgala apna leya tha kae bar hadsa hotey hotey rah geya tha lakin 1983 mein iss tara ki taiz driwing key dauran un ki gari aik darakht se takra gae unki jan to bach gae lakin charey pewr zakham ka nishan par geya shadeed mausi key alam mein woh apnay dost Parvaiz Malik key pas gaey aur zindagi mein pehli bar un se kam manga Parvaiz Malik nay un key zakham zada charey ki taraf dekh ker kaha key tum theek ho jao to kam hi kam hay
1922,Positive,Lol
1923,Negative,yaar koi sharam hoti h koi hyaa hoti h
1924,Negative,Bahi g ap ka what s up number he band ha order kis par karin
1925,Positive,Bilkul right
1926,Positive,Ghalib ke kalam se shora ko ye sekhna chaheye ke apne dork o batin mein yun sachai se ameza aur mehsos kiya jaye ke khayal sheri takhliq ban kar baramad ho aur is mein kahein masnoi pan ka shuba tak na ho
1927,Negative,Hahaha kion keh hum perhate hi nahi hain
1928,Positive,Murshid Pak kram ki ik nazar idr b frmayen
1929,Positive,Beshk ALLAH bht Rehm krny wla hy
1930,Negative,Is tarha 8 saal mein mukamal hone wale sab se bare sanati unit ko aik ghante ki karwai mein farikhat kar deya gaya
1931,Negative,Un ko yakeen tha tha k bomb banaya ja raha hai aur hamain ye sakhti se bata diya gaya k agar kuch bhi Karachi main phata to wo phaswa dain gay
1932,Positive,Financial times ne unhein woman of the 2013 qarar diya
1933,Negative,2 Wo Jo Mushkil Halaat Me Sath Chorr De
1934,Positive,1964 ke bad jab Mohibbullah Khan ne British open title jeeta Pakistan ko yeh ejaz 1965 mein hasil hua iss martaba dono Pakistani khelari Qamar Zaman aur Gogi Allauddin pahonche they lahza title to Pakistan ana hi tha Qamar ne Gogi ko shikast de ker pahli martaba Open jeetne ka ejaz hasil keya
1935,Negative,Galat baat mat karo ya bilkul nahai likha huwa Farig log koi aur kam nahai ha karnay ko jo ya galat batain bolty rehtay ho Jhail
1936,Negative,Yaar maine tw poori vdo hi nhi dekhi in aunty ko kuch hogaya h or peechy jo talliyaan baja rahy hain unhe bhi kuch hogaya h ajeeb Imran khan is the best
1937,Positive,Tb angrez gaye to India Pak ko lara gaye Ab phr wohi ho rha hai Umeed hai smj nai ho gi
1938,Positive,8 baras tak film beeno aur jaraiyd mein barhti hui maqboliyat ke sath is ne apne role ko ba khobi ada karte hue glamour ki chakachond kar dene wali duniya ke mutabiq khud ko munasib andaaz mein dhal liya hai
1939,Positive,Allah apka hami o nasir rahy amin
